<?xml version="1.0"?>
<!--sudo apt install libxml2-utils; xmllint &#45;&#45;noout &#45;&#45;schema ../schema.xsd phxbinlogsvr.xml -->
<phxrpc xmlns:xsi="http://www.w3.org/2001/XMLSchema-instance"
        xsi:noNamespaceSchemaLocation="./schema.xsd">
    <package>storesvr</package>
    <message name="SectionInfo">
        <field type="uint32" name="sect_id">1</field>
        <!--  uid号段sect_id => 最大的序列号 -->
        <field type="uint64" name="max_seq">2</field>
    </message>

    <message name="SectionList">
        <field type="SectionInfo" repeated="true" name="sections">1</field>
    </message>
    <imports>
        <import>google/protobuf/wrappers.proto</import>
    </imports>
</phxrpc>